{
  "id": "pr-review-noise-reduction",
  "type": "feature",
  "status": "implementing",
  "version": 1,
  "created": "2026-03-21T06:02:38Z",
  "updated": "2026-03-21T06:05:51Z",
  "specopsCreatedWith": "1.3.0",
  "specopsUpdatedWith": "1.3.0",
  "author": {
    "name": "sanmak"
  },
  "reviewers": [],
  "reviewRounds": 0,
  "approvals": 0,
  "requiredApprovals": 0
}
