{
  "id": "ears-notation",
  "type": "feature",
  "status": "completed",
  "version": 1,
  "created": "2026-03-07T12:00:00Z",
  "updated": "2026-03-07T12:30:00Z",
  "author": {
    "name": "sanmak"
  },
  "reviewers": [],
  "reviewRounds": 0,
  "approvals": 0,
  "requiredApprovals": 1,
  "specopsCreatedWith": "1.2.0",
  "specopsUpdatedWith": "1.2.0"
}
