{
  "id": "context-aware-dispatch",
  "type": "feature",
  "status": "completed",
  "version": 1,
  "created": "2026-03-21T06:35:16Z",
  "updated": "2026-03-21T07:23:41Z",
  "specopsCreatedWith": "1.3.0",
  "specopsUpdatedWith": "1.3.0",
  "author": {
    "name": "sanmak"
  },
  "reviewers": [],
  "reviewRounds": 0,
  "approvals": 0,
  "requiredApprovals": 0,
  "metrics": {
    "specArtifactTokensEstimate": 7985,
    "filesChanged": 0,
    "linesAdded": 0,
    "linesRemoved": 0,
    "tasksCompleted": 10,
    "acceptanceCriteriaVerified": 67,
    "specDurationMinutes": 47
  }
}
